{"kind":"UISpecCurrent","layer":"Current","explorationArtifactRef":"ui_spec_support_issue.exploration","sourceRefs":["ui_spec_support_issue.raw","ui_spec_support_issue.exploration","user_journey_support_issue.current","flow_model_support_issue.current","low_fi_prototype_guided_issue_intake.current","capability_map_support_issue.current"],"visualSystem":{"styleId":"institutional_saas","title":"机构化 SaaS","sourceType":"selected_exploration_style","designMdRef":"design-styles/institutional-saas.md","tokenSummary":{"primary":"#1A1C1E","secondary":"#6C7278","accent":"#B8422E","neutral":"#F7F5F2","surface":"#FFFDFA","success":"#1F6B57","warning":"#A66A00","error":"#B8422E","typography":"Public Sans","radius":"紧凑的 4px 到 12px 卡片和控件圆角","spacing":"8px 节奏的紧凑企业卡片"},"applicationRules":["每个页面只保留一个主操作，并为状态颜色配明确文字。","在录入、复核和追踪页面同时展示证据、负责人和下一步动作。","长时间工作区使用暖中性色表面，红色只用于破坏性或失败状态。"]},"uiArchitecture":{"workspaces":[{"workspaceId":"support_issue_portal","name":"支持问题门户","primaryUser":"客户门户用户","anchoredArtifacts":["支持问题","证据附件","状态更新"],"capabilityRefs":["support_issue_triage","evidence_readiness","owner_sla_visibility","issue_tracking","issue_reopen"],"defaultPageId":"help_entry"}],"navigationRules":["帮助入口允许客户选择自助解决、提交新问题或追踪已有工单。","开始提交问题会进入证据收集，只有证据状态可提交时才进入提交确认（提交前复核）。","提交确认创建支持问题并路由到状态追踪；状态追踪可在等待客户时回到证据收集补充材料。"],"anchoredArtifacts":[{"artifactType":"支持问题","pageIds":["help_entry","evidence_request","submit_review","tracking_status"]},{"artifactType":"证据附件","pageIds":["evidence_request","submit_review"]},{"artifactType":"状态更新","pageIds":["tracking_status"]}],"crossWorkspaceInteractions":["Interaction Contract 会将客户门户提交映射到支持队列创建，同时不暴露内部队列控件。"],"routeMap":[{"fromPageId":"help_entry","toPageId":"evidence_request","trigger":"开始提交问题","queryParams":{"category":"vpn"},"sourceFlowEdgeRef":"flow:Find help->Describe issue"},{"fromPageId":"help_entry","toPageId":"tracking_status","trigger":"追踪已有工单","queryParams":{"ticket":"SUP-1042","state":"in_triage"}},{"fromPageId":"evidence_request","toPageId":"submit_review","trigger":"继续确认","queryParams":{"ticket":"SUP-1042","evidence":"screenshot"},"sourceFlowEdgeRef":"flow:Attach evidence->Submit issue"},{"fromPageId":"submit_review","toPageId":"tracking_status","trigger":"提交问题","queryParams":{"ticket":"SUP-1042","state":"in_triage"},"sourceFlowEdgeRef":"flow:Submit issue->Track status"},{"fromPageId":"tracking_status","toPageId":"evidence_request","trigger":"补充被要求的证据","guard":"waiting_for_customer","queryParams":{"ticket":"SUP-1042","returnTo":"tracking_status"}}],"smokePath":["help_entry","evidence_request","submit_review","tracking_status"]},"pageSpecs":[{"pageId":"help_entry","workspaceId":"support_issue_portal","title":"帮助入口","route":"help-entry.html","sourceFile":"demo-pages/support-issue-ui-spec/current-guided-intake.html","pageType":"entry_and_routing","purpose":"选择自助解决、提交新问题或追踪已有问题。","sourceRefs":["low_fi_prototype_guided_issue_intake.current#help_entry","flow_model_support_issue.current#find_help"],"dataSources":["knownIncidentList","supportIssueLookup"],"layout":{"pattern":"entry_choice_surface","center":"搜索框、已知事件提示和主路径选择","right":"追踪已有工单入口"},"previewFile":"demo-pages/support-issue-ui-spec/current-guided-intake.html","defaultParams":{"category":"vpn"},"components":[],"states":[],"interactions":["start_issue","track_existing_issue"],"accessibility":["入口操作使用真实按钮并保留可见标签。","搜索和跳转控件按阅读顺序可键盘访问。"],"evidenceRefs":["researches/ui_spec.md"]},{"pageId":"evidence_request","workspaceId":"support_issue_portal","title":"证据收集","route":"evidence-request.html","sourceFile":"demo-pages/support-issue-ui-spec/current-guided-intake.html","pageType":"guided_form","purpose":"提交前收集问题事实和证据，并显示证据就绪度。","sourceRefs":["low_fi_prototype_guided_issue_intake.current#evidence_request","flow_model_support_issue.current#attach_evidence","capability_map_support_issue.current#evidence_readiness"],"dataSources":["supportIssueDraft","evidenceAttachmentList","issueCategoryRules"],"layout":{"pattern":"three_zone_task_surface","left":"路径步骤","center":"问题事实和证据字段","right":"证据就绪度卡片"},"previewFile":"demo-pages/support-issue-ui-spec/current-guided-intake.html","defaultParams":{"category":"vpn","ticket":"SUP-1042"},"components":["evidence_readiness_card"],"states":["missing_evidence"],"interactions":["continue_to_review"],"accessibility":["每个字段都保留可见标签。","证据状态同时使用文字和颜色。"],"evidenceRefs":["researches/ui_spec.md"]},{"pageId":"submit_review","workspaceId":"support_issue_portal","title":"提交确认（提交前复核）","route":"submit-review.html","sourceFile":"demo-pages/support-issue-ui-spec/current-guided-intake.html","pageType":"review_and_confirm","purpose":"最终提交前评审工单摘要、证据状态和负责人/SLA 预期。","sourceRefs":["low_fi_prototype_guided_issue_intake.current#submit_review","flow_model_support_issue.current#submit_issue"],"dataSources":["supportIssueDraft","evidenceReadinessResult","customerSafeSlaPolicy"],"layout":{"pattern":"review_summary_with_status_rail","center":"问题摘要、证据状态和提交后果","right":"负责人/SLA 卡片"},"previewFile":"demo-pages/support-issue-ui-spec/current-guided-intake.html","defaultParams":{"ticket":"SUP-1042","evidence":"screenshot"},"components":["evidence_readiness_card","owner_sla_card"],"states":["submission_error"],"interactions":["review_and_submit"],"accessibility":["提交错误将焦点移到错误摘要，并保留客户输入。","提交后果在主操作前用文字说明。"],"evidenceRefs":["researches/ui_spec.md"]},{"pageId":"tracking_status","workspaceId":"support_issue_portal","title":"状态追踪","route":"tracking-status.html","sourceFile":"demo-pages/support-issue-ui-spec/current-guided-intake.html","pageType":"status_detail","purpose":"展示工单状态、下一步、负责人和时间线。","sourceRefs":["low_fi_prototype_guided_issue_intake.current#tracking_status","flow_model_support_issue.current#status_tracking","capability_map_support_issue.current#issue_tracking"],"dataSources":["supportIssue","statusEventList","customerVisibleOwnerSla"],"layout":{"pattern":"status_timeline_with_next_action","center":"状态时间线和下一步动作","right":"负责人/SLA 卡片和补充证据入口"},"previewFile":"demo-pages/support-issue-ui-spec/current-guided-intake.html","defaultParams":{"ticket":"SUP-1042","state":"in_triage"},"components":["owner_sla_card","status_timeline"],"states":["waiting_for_update"],"interactions":["add_requested_evidence"],"accessibility":["时间线条目是有明确时间戳和状态名称的有序列表项。","补充证据操作说明会携带当前工单上下文。"],"evidenceRefs":["researches/ui_spec.md"]}],"componentSpecs":[{"componentId":"evidence_readiness_card","name":"证据就绪度卡片","componentType":"status_card","usage":"在录入和复核页面展示该问题分类的必需、可选、完整、缺失和延期证据。","variants":["default_ready_to_submit","missing_required_evidence","optional_evidence_available"],"states":["complete","incomplete","deferred","error"],"tokenRefs":["colors.success","colors.warning","colors.error","rounded.md","spacing.md"],"keyboardBehavior":["Tab 会在第一条可操作证据行进入卡片。","Enter 或 Space 激活上传、替换或移除控件。","Escape 将焦点从证据详情弹出层返回到触发行。"],"accessibility":["为每种证据状态使用文字标签和图标。","上传或移除后播报就绪度摘要。","不依赖仅悬停可见的来源标签。"],"sourceRefs":["user_journey_support_issue.current#evidence_confusion","flow_model_support_issue.current#evidence_guard","capability_map_support_issue.current#evidence_readiness"]},{"componentId":"owner_sla_card","name":"负责人和 SLA 卡片","componentType":"info_card","usage":"在录入复核和状态上下文中呈现客户安全的支持负责人、预计更新时间和下一步动作。","variants":["queue_and_update_window","update_window_only","policy_hidden"],"states":["active","waiting_for_update","policy_unavailable"],"tokenRefs":["colors.neutral","colors.primary","colors.warning","rounded.md"],"keyboardBehavior":["信息内容在阅读顺序中先于破坏性或重开操作到达。","任何政策详情披露都从标准按钮打开，并返回焦点。"],"accessibility":["负责人和更新时间使用纯文字，而不只依赖时间线位置。","政策隐藏状态解释负责人详情不可用的原因。"],"sourceRefs":["user_journey_support_issue.current#waiting_phase","capability_map_support_issue.current#owner_sla_visibility"]},{"componentId":"status_timeline","name":"状态时间线","componentType":"timeline","usage":"展示客户可见的支持问题生命周期事件、澄清请求、预计更新和重开上下文。","variants":["draft_to_submitted","waiting_for_update","clarification_requested","resolved_with_reopen"],"states":["current","completed","attention_needed","reopened"],"tokenRefs":["colors.primary","colors.success","colors.warning","colors.error","spacing.sm"],"keyboardBehavior":["时间线是有序列表，只有包含操作的行才可获得焦点。","澄清和重开操作在焦点返回时保留上下文。"],"accessibility":["当前状态用 aria-current 或等效实现语义暴露。","实现时，时间戳同时使用可读文本和机器可读值。"],"sourceRefs":["flow_model_support_issue.current#status_tracking","capability_map_support_issue.current#issue_tracking","capability_map_support_issue.current#issue_reopen"]}],"interactionSpecs":[{"interactionId":"start_issue","trigger":"客户在帮助入口选择开始提交问题。","target":"evidence_request 页面","guard":"客户没有找到足够的自助解决内容。","mutation":"创建支持问题草稿并携带分类建议。","successFeedback":"展示证据收集页面和当前路径步骤。","failureRecovery":"保留搜索词并提供追踪已有工单入口。","sourceFlowRefs":["flow_model_support_issue.current#find_help"],"evidenceRefs":["researches/ui_spec.md"]},{"interactionId":"track_existing_issue","trigger":"客户在帮助入口选择追踪已有工单。","target":"tracking_status 页面","guard":"客户提供工单号或系统找到最近工单。","mutation":"加载客户可见状态和时间线。","successFeedback":"展示工单状态、负责人/SLA 和下一步动作。","failureRecovery":"提示工单号无效并保留重新输入。","sourceFlowRefs":["flow_model_support_issue.current#status_tracking"],"evidenceRefs":["researches/ui_spec.md"]},{"interactionId":"continue_to_review","trigger":"客户完成证据收集后继续确认。","target":"submit_review 页面","guard":"必需证据已完整或明确延期。","mutation":"冻结草稿摘要和证据状态。","successFeedback":"展示提交确认（提交前复核）页面。","failureRecovery":"聚焦缺失证据摘要并允许继续编辑。","sourceFlowRefs":["flow_model_support_issue.current#evidence_guard"],"evidenceRefs":["researches/ui_spec.md"]},{"interactionId":"review_and_submit","trigger":"客户从提交确认中选择提交问题。","target":"tracking_status 页面和支持问题创建命令","guard":"客户已确认摘要和证据状态。","mutation":"创建支持问题并附加证据引用。","successFeedback":"展示已提交状态、问题引用、负责人/SLA 卡片和状态时间线条目。","failureRecovery":"保持草稿不变，将焦点移到错误摘要并提供重试。","sourceFlowRefs":["flow_model_support_issue.current#review_submit"],"evidenceRefs":["researches/ui_spec.md"]},{"interactionId":"add_requested_evidence","trigger":"客户在状态追踪中选择补充被要求的证据。","target":"evidence_request 页面","guard":"问题处于等待客户补充证据状态。","mutation":"带当前工单上下文回到证据收集。","successFeedback":"显示原工单号和缺失证据要求。","failureRecovery":"解释无法补充的政策原因并保留状态页面。","sourceFlowRefs":["flow_model_support_issu